Gene Symbol	Name	Entrez GeneId	Genome Location	Tier	Hallmark	Chr Band	Somatic	Germline	Tumour Types(Somatic)	Tumour Types(Germline)	Cancer Syndrome	Tissue Type	Molecular Genetics	Role in Cancer	Mutation Types	Translocation Partner	Other Germline Mut	Other Syndrome	Synonyms
ERC1	ELKS/RAB6-interacting/CAST family member 1	23085	12:1027747-1495924	1		12p13.33	yes		"papillary thyroid, Spitzoid tumour"			E	Dom	fusion	T	"RET, ROS1"			"CAST2,CCDS8508.1,ELKS,ENSG00000082805.19,KIAA1081,MGC12974,NM_178040.3,NP_829884,Q8IUD2,RAB6IP2"
ERCC2	"excision repair cross-complementing rodent repair deficiency, complementation group 2 (xeroderma pigmentosum D)"	2068	19:45349837-45370587	1	Yes	19q13.32		yes		"skin basal cell, skin squamous cell, melanoma"	xeroderma pigmentosum (D)	E	Rec	TSG	"Mis, N, F, S"				"CCDS33049.1,EM9,ENSG00000104884.15,MAG,MGC102762,MGC126218,MGC126219,NM_000400.3,NP_000391,P18074,TFIIH,XPD"
ERCC3	"excision repair cross-complementing rodent repair deficiency, complementation group 3 (xeroderma pigmentosum group B complementing)"	2071	2:127257290-127294176	1	Yes	2q14.3		yes		"skin basal cell, skin squamous cell, melanoma"	xeroderma pigmentosum (B)	E	Rec	TSG	"Mis, S"				"BTF2,CCDS2144.1,ENSG00000163161.13,GTF2H,NM_001303418.1,NP_000113,NP_001290345.1,NP_001290347.1,P19447,RAD25,TFIIH,XPB"
ERCC4	"excision repair cross-complementing rodent repair deficiency, complementation group 4"	2072	16:13920157-13952345	1	Yes	16p13.12		yes		"skin basal cell, skin squamous cell, melanoma"	xeroderma pigmentosum (F)	E	Rec	TSG	"Mis, N, F"				"CCDS32390.1,ENSG00000175595.14,FANCQ,NM_005236.2,NP_005227,Q92889,RAD1,XPF"
ERCC5	"excision repair cross-complementing rodent repair deficiency, complementation group 5 (xeroderma pigmentosum, complementation group G (Cockayne syndrome))"	2073	13:102844844-102876001	1	Yes	13q33.1		yes		"skin basal cell, skin squamous cell, melanoma"	xeroderma pigmentosum (G)	E	Rec	TSG	"Mis, N, F"				"CCDS32004.1,ENSG00000134899.19,ERCM2,NM_000123.3,NP_000114,NP_000114.2,P28715,XPGC"
ERG	v-ets erythroblastosis virus E26 oncogene like (avian)	2078	21:38380027-38661694	1	Yes	21q22.2	yes		"Ewing sarcoma, prostate, AML"			"M, E, L"	Dom	"oncogene, fusion"	"T, A"	"EWSR1, TMPRSS2, ELF4, FUS, HERPUD1, NDRG1"			"CCDS46648.1,ENSG00000157554.18,NM_001243432.2,NP_001129626,NP_001230361.1,P11308,erg-3,p55"
ESR1	estrogen receptor 1	2099	6:151690496-152103274	1	Yes	6q25.2	yes		breast			E	Dom	"oncogene, TSG, fusion"	"Mis, T"				"CCDS5234.1,ENSG00000091831.23,ER-alpha,ESR,Era,NM_001122742.1,NP_001116214,NR3A1,P03372"
ETNK1	ethanolamine kinase 1	55500	12:22625075-22690665	1	Yes	12p12.1	yes		"aCML, CMML, SM-AHD, HES"			L	Dom	TSG	Mis				"CCDS8698.1,EKI,EKI1,ENSG00000139163.15,NM_018638.4,NP_061108,Q9HBU6"
ETV1	ets variant gene 1	2115	7:13891228-13989946	1		7p21.2	yes		"Ewing sarcoma, prostate"			"M, E"	Dom	"oncogene, fusion"	T	"EWSR1, TMPRSS2, SLC45A3, HMGN2P46, HNRNPA2B1. ACSL3"			"CCDS55088.1,ENSG00000006468.13,ER81,NM_004956.4,NP_004947,P50549"
ETV4	"ets variant gene 4 (E1A enhancer binding protein, E1AF)"	2118	17:43527844-43546432	1		17q21.31	yes		"Ewing sarcoma, prostate carcinoma"			"M, E"	Dom	"oncogene, fusion"	T	"EWSR1, TMPRSS2, DDX5, KLK2, CANT1"			"CCDS11465.1,E1A-F,E1AF,ENSG00000175832.12,NM_001079675.2,NP_001073143,P43268,PEA3"
ETV5	ets variant gene 5	2119	3:186046308-186109112	1		3q27.2	yes		prostate			E	Dom	"oncogene, fusion"	T	"TMPRSS2, SCL45A3"			"CCDS33906.1,ENSG00000244405.7,ERM,NM_004454.2,NP_004445,P41161"
ETV6	ets variant gene 6 (TEL oncogene)	2120	12:11649854-11895402	1	Yes	12p13.2	yes		"congenital fibrosarcoma, multiple different leukaemia and lymphoma tumour types including ALL, secretory breast, MDS"			"L, E, M"	Dom	"TSG, fusion"	T	"NTRK3, RUNX1, PDGFRB, ABL1, MN1, ABL2, ACSL6, CHIC2, ARNT, JAK2, MECOM, CDX2, RNF217-AS1, MNX1, MDS2, PER1, SYK, TTL, FGFR3, PAX5"			"CCDS8643.1,ENSG00000139083.10,NM_001987.4,NP_001978,P41212,TEL"
EWSR1	Ewing sarcoma breakpoint region 1 (EWS)	2130	22:29268316-29300343	1	Yes	22q12.2	yes		"Ewing sarcoma, desmoplastic small round cell tumour , ALL, clear cell sarcoma, sarcoma, myoepithelioma, mesothelioma"			"L, M, E"	Dom	"oncogene, fusion"	T	"FLI1, ERG, NR4A3, FEV, ATF1, ETV1, ETV4, WT1, ZNF384, CREB1, POU5F1,  PBX1, NFATC1, NFATC2, DDIT3, PATZ1, SMARCA5, SP3, ZNF444, YY1"			"CCDS13852.2,ENSG00000182944.17,EWS,NM_013986.3,NP_053733,Q01844"
EXT1	multiple exostoses type 1 gene	2131	8:117794490-118111853	1		8q24.11		yes		"exostoses, osteosarcoma"	multiple exostoses type 1	M	Rec	"TSG, fusion"	"Mis, N, F, S, T"				"CCDS6324.1,ENSG00000182197.10,LGCR,LGS,NM_000127.2,NP_000118,Q16394,ttv"
EXT2	multiple exostoses type 2 gene	2132	11:44096197-44245429	1		11p11.2		yes		"exostoses, osteosarcoma"	multiple exostoses type 2	M	Rec	TSG	"Mis, N, F, S"				"CCDS53618.1,ENSG00000151348.13,NM_000401.3,NP_000392,Q93063,SOTV"
EZH2	enhancer of zeste homolog 2	2146	7:148807385-148884278	1	Yes	7q36.1	yes		DLBCL			L	Dom	"oncogene, TSG"	Mis				"CCDS5891.1,ENSG00000106462.10,ENX-1,EZH1,KMT6,KMT6A,NM_004456.4,NP_004447,Q15910"
EZR	ezrin	7430	6:158765748-158819412	1	Yes	6q25.3	yes		NSCLC			E	Dom	fusion	T	ROS1			"CCDS5258.1,ENSG00000092820.17,NM_001111077.1,NP_001104547,P15311,VIL2"
FADD	Fas Associated Via Death Domain	8772	11:70203163-70207390	2		11q13.3	yes	yes	"breast cancer, HNSCC"			"E, L"			A				"CCDS8196.1,ENSG00000168040.4,GIG3,MORT1,NM_003824.3,NP_003815,Q13158"
FAM131B	"family with sequence similarity 131, member B"	9715	7:143353400-143362752	2		7q34	yes		pilocytic astrocytoma			O	Dom	fusion	T	BRAF			"CCDS47734.1,ENSG00000159784.17,KIAA0773,NM_001031690.2,NP_001026860,Q86XD5"
FAM135B	family with sequence similarity 135 member B	51059	8:138130023-138496822	2		8q24.23	yes		SCLC			E			Mis				"C8ORFK32,CCDS6375.2,ENSG00000147724.11,NM_015912.3,NP_056996,Q49AJ0"
FAM47C	family with sequence similarity 47 member C	442444	X:37008397-37011666	2		Xp21.1	yes		"melanoma, clear cell sarcoma of soft parts, SCLC"			"E, M"			Mis				"CCDS35227.1,ENSG00000198173.4,NM_001013736.2,NP_001013758,Q5HY64"
FANCA	"Fanconi anemia, complementation group A"	2175	16:89737549-89816646	1		16q24.3		yes		"AML, leukaemia"	Fanconi anaemia A	L	Rec	TSG	"D, Mis, N, F, S"				"CCDS32515.1,ENSG00000187741.14,FA-H,FAA,FACA,FAH,FANCH,NM_000135.2,NP_000126,O15360"
FANCC	"Fanconi anemia, complementation group C"	2176	9:95099054-95317702	1		9q22.32		yes		"AML, leukaemia"	Fanconi anaemia C	L	Rec	TSG	"D, Mis, N, F, S"				"CCDS35071.1,ENSG00000158169.12,FA3,FAC,FACC,NM_000136.2,NP_000127,Q00597"
FANCD2	"Fanconi anemia, complementation group D2"	2177	3:10026414-10099660	1	Yes	3p25.3		yes		"AML, leukaemia"	Fanconi anaemia D2	L	Rec	TSG	"D, Mis, N, F"				"CCDS2595.1,ENSG00000144554.10,FA-D2,FACD,FAD,FANCD,NM_033084.4,NP_149075,Q9BXW9"
FANCE	"Fanconi anemia, complementation group E"	2178	6:35452361-35467103	1		6p21.31		yes		"AML, leukaemia"	Fanconi anaemia E	L	Rec	TSG	"N, F, S"				"CCDS4805.1,ENSG00000112039.3,FACE,FAE,NM_021922.2,NP_068741,Q9HB96"
FANCF	"Fanconi anemia, complementation group F"	2188	11:22622519-22626787	1		11p14.3		yes		"AML, leukaemia"	Fanconi anaemia F	L	Rec	TSG	"N, F"				"CCDS7857.1,ENSG00000183161.4,FAF,NM_022725.3,NP_073562,Q9NPI8"
FANCG	"Fanconi anemia, complementation group G"	2189	9:35073838-35080016	1		9p13.3		yes		"AML, leukaemia"	Fanconi anaemia G	L	Rec	TSG	"Mis, N, F, S"				"CCDS6574.1,ENSG00000221829.9,FAG,NM_004629.1,NP_004620,O15287,XRCC9"
FAS	Fas cell surface death receptor	355	10:88990657-89015785	1	Yes	10q23.31	yes		"TGCT, nasal NK/T lymphoma, skin squamous cell carcinoma-burn scar related"			"L, E, O"	Rec	TSG	Mis		yes	Autoimmune lymphoproliferative syndrome	"APO-1,APT1,CCDS7393.1,CD95,ENSG00000026103.21,FAS1,NM_000043.5,NP_000034,P25445,TNFRSF6"
FAT1	FAT atypical cadherin 1	2195	4:186587783-186723855	1	Yes	4q35.2	yes	yes	"oral squamous cell, chemorefractory CLL, head and neck, pancreatic acinar cell carcinoma"	pancreatic		"E, L"		TSG	"Mis, N, F, S"				"CCDS47177.1,CDHF7,CDHR8,ENSG00000083857.13,FAT,NM_005245.3,NP_005236,Q14517"
FAT3	FAT atypical cadherin 3	120114	11:92352541-92896470	2		11q14.3	yes		"SCC, colon adenocarcinoma, gastric adenocarcinoma"			E			Mis				"CDHF15,CDHR10,ENSG00000165323.15,KIAA1989"
FAT4	FAT atypical cadherin 4	79633	4:125316399-125492932	1	Yes	4q28.1	yes		"lymphoma, pancreatic, head and neck, melanoma, hepatocellular carcinoma"			"E, L"		TSG	"Mis, N"		yes	"Hennekam lymphangiectasia-lymphedema syndrome 2, Van Maldergem syndrome 2"	"CCDS3732.3,CDHF14,CDHR11,ENSG00000196159.11,FAT-J,NM_024582.4,NP_078858,NP_001278214.1,NP_001278232.1,Q6V0I7"
FBLN2	fibulin 2	2199	3:13549131-13638422	2		3p25.1	yes		"breast cancer, colorectal adenocarcinoma"			E		TSG	"Mis, S"				"CCDS46761.1,ENSG00000163520.13,NM_001004019.1,NP_001004019,P98095"
FBXO11	F-box protein 11	80204	2:47806920-47905793	1	Yes	2p16.3	yes		DLBCL			L	Rec	TSG	"Mis, F, D"				"CCDS54357.1,ENSG00000138081.20,FBX11,NM_001190274.1,NP_001177203,Q86XK2,UBR6"
FBXW7	"F-box and WD-40 domain protein 7 (archipelago homolog, Drosophila)"	55294	4:152320544-152536063	1	Yes	4q31.3	yes		"colorectal, endometrial, T-ALL"			"E, L"	Rec	TSG	"Mis, N, D, F"				"AGO,CCDS3777.1,CDC4,ENSG00000109670.14,FBW7,FBX30,FBXW6,FLJ11071,NM_033632.3,NP_361014,Q969H0,SEL-10,SEL10"
FCGR2B	"Fc fragment of IgG, low affinity IIb, receptor for (CD32)"	2213	1:161663161-161678654	1	Yes	1q23.3	yes		ALL			L	Dom	"oncogene, fusion"	T	?			"CCDS30924.1,CD32,CD32B,ENSG00000072694.20,FCG2,FCGR2,NM_004001.4,NP_003992,NP_001002275.1,P31994"
FCRL4	Fc receptor-like 4	83417	1:157573749-157598080	1		1q23.1	yes		B-NHL			L	Dom	"oncogene, fusion"	T	IGH			"CCDS1166.1,CD307d,ENSG00000163518.10,FCRH4,IGFP2,IRTA1,NM_031282.2,NP_112572,Q96PJ5"
FEN1	flap structure-specific endonuclease 1	2237	11:61792637-61797244	2		11q12.2		yes		breast cancer		E		TSG					"CCDS8010.1,ENSG00000168496.3,FEN-1,MF1,NM_004111.5,NP_004102,P39748,RAD2"
FES	"FES proto-oncogene, tyrosine kinase"	2242	15:90884412-90895776	1	Yes	15q26.1	yes		"HNSCC, ovarian carcinoma"			E		"oncogene, TSG"	"Mis, F"				"CCDS10365.1,ENSG00000182511.11,FPS,NM_002005.3,NP_001996,P07332"
FEV	FEV protein - (HSRNAFEV)	54738	2:218981087-218985657	1		2q35	yes		Ewing sarcoma			M	Dom	"oncogene, fusion"	T	"EWSR1,  FUS"			"CCDS2428.1,ENSG00000163497.2,NM_017521.2,NP_059991,Pet-1,Q99581"
FGFR1	fibroblast growth factor receptor 1	2260	8:38411138-38467845	1	Yes	8p11.23	yes		"MPN, NHL, salivary adenoma"			L	Dom	"oncogene, fusion"	T	"BCR, FOP, ZMYM2, CNTRL, PLAG1"	yes	"Pfeiffer syndrome, Kallman syndrome"	"BFGFR,CCDS55223.1,CD331,CEK,ENSG00000077782.19,FLG,FLT2,H2,H3,H4,H5,KAL2,N-SAM,NM_001174067.1,NP_001167538,P11362"
FGFR1OP	FGFR1 oncogene partner (FOP)	11116	6:166999182-167052713	1		6q27	yes		"MPN, NHL"			L	Dom	fusion	T	FGFR1			"CCDS5296.1,ENSG00000213066.12,FOP,NM_007045.3,NP_008976,O95684"
FGFR2	fibroblast growth factor receptor 2	2263	10:121479857-121598403	1	Yes	10q26.13	yes		"gastric, NSCLC, endometrial"			E	Dom	"oncogene, fusion"	"Mis, T"		yes	"Crouzon, Pfeiffer, and Apert syndromes"	"BEK,CCDS7620.2,CD332,CEK3,CFD1,ECT1,ENSG00000066468.22,JWS,K-SAM,KGFR,NM_022970.3,NP_075259,P21802,TK14,TK25"
FGFR3	fibroblast growth factor receptor 3	2261	4:1793312-1808872	1	Yes	4p16.3	yes		"bladder, MM, T-cell lymphoma"			"L, E"	Dom	"oncogene, fusion"	"Mis, T"	"IGH, ETV6"	yes	"Hypochondroplasia, Thanatophoric dysplasia"	"ACH,CCDS54706.1,CD333,CEK2,ENSG00000068078.18,JTK4,NM_001163213.1,NP_001156685.1,P22607"
FGFR4	fibroblast growth factor receptor 4	2264	5:177086886-177098144	1	Yes	5q35.2	yes		rhabdomyosarcoma			M	Dom	oncogene	Mis				"CCDS4410.1,CD334,ENSG00000160867.14,JTK2,NM_213647.2,NP_998812,NP_002002,NP_001341913.1,P22455"
FH	fumarate hydratase	2271	1:241497603-241519761	1		1q43		yes		"leiomyomatosis, renal"	hereditary leiomyomatosis and renal cell cancer	"E, M"	Rec	TSG	"Mis, N, F"				"CCDS1617.1,ENSG00000091483.6,NM_000143.3,NP_000134,P07954"
FHIT	fragile histidine triad gene	2272	3:59751407-61251459	1	Yes	3p14.2	yes		pleomorphic salivary gland adenoma			E	Dom	"TSG, fusion"	T	HMGA2			"AP3Aase,CCDS2894.1,ENSG00000189283.9,FRA3B,NM_001320900.1,NP_001307828,NP_001307829,P49789"
FIP1L1	FIP1 like 1 (S. cerevisiae)	81608	4:53377645-53459668	1		4q12	yes		idiopathic hypereosinophilic syndrome			L	Dom	fusion	T	PDGFRA			"CCDS3491.1,DKFZp586K0717,ENSG00000145216.15,FIP1,NM_030917.3,NP_112179,Q6UN15"
FKBP9	FK506 binding protein 9	11328	7:32957404-33006930	2		7p14.3	yes		glioma			O			Mis				"CCDS64622.1,ENSG00000122642.10,FKBP60,FKBP63,NM_001284341.1,NP_001271270,O95302"
FLCN	folliculin	201163	17:17212212-17237139	1		17p11.2		yes		"renal, fibrofolliculomas, trichodiscomas"	Birt-Hogg-Dube syndrome	"E, M"	Rec	TSG	"Mis. N, F"				"BHD,CCDS32579.1,ENSG00000154803.12,MGC17998,MGC23445,NM_144997.5,NP_659434,NP_001340160.1,NP_001340159.1,Q8NFG4"
FLI1	Friend leukemia virus integration 1	2313	11:128693770-128813267	1		11q24.3	yes		Ewing sarcoma			M	Dom	"oncogene, fusion"	T	EWSR1			"CCDS44768.1,ENSG00000151702.16,EWSR2,NM_002017.4,NP_002008,Q01543,SIC-1"
FLNA	filamin A	2316	X:154348526-154374638	2		Xq28	yes		phyllodes tumour of the breast			E			"Mis, F, O"				"ABP-280,CCDS48194.1,ENSG00000196924.15,FLN,FLN1,NM_001110556.1,NP_001104026,OPD1,OPD2,P21333"
FLT3	fms-related tyrosine kinase 3	2322	13:28003274-28100592	1	Yes	13q12.2	yes		"AML, ALL"			L	Dom	oncogene	"Mis, O"				"CCDS31953.1,CD135,ENSG00000122025.14,FLK2,NM_004119.2,NP_004110,P36888,STK1"
FLT4	fms-related tyrosine kinase 4	2324	5:180601506-180649624	1	Yes	5q35.3	yes		soft tissue sarcoma			M	Dom	oncogene	A				"CCDS4457.1,ENSG00000037280.15,NM_182925.4,NP_891555,P35916,PCL,VEGFR3"
FNBP1	formin binding protein 1 (FBP17)	23048	9:129887187-130043162	2		9q34.11	yes		AML			L	Dom	fusion	T	KMT2A			"CCDS48040.1,ENSG00000187239.16,FBP17,KIAA0554,NM_015033.2,NP_055848,Q96RU3"
FOXA1	forkhead box A1	3169	14:37589984-37595034	1	Yes	14q21.1	yes		"breast, prostate"			E	Dom	oncogene	"Mis, F"				"CCDS9665.1,ENSG00000129514.5,HNF3A,NM_004496.3,NP_004487,P55317"
FOXL2	forkhead box L2	668	3:138944224-138947140	1	Yes	3q22.3	yes		granulosa-cell tumour of the ovary			O	Dom	"oncogene, TSG"	Mis		yes	"Blepharophimosis, ptosis and epicanthus inversus Types I, II; Premature ovarian failure type III"	"BPES,BPES1,CCDS3105.1,ENSG00000183770.5,NM_023067.3,NP_075555,P58012"
FOXO1	forkhead box O1	2308	13:40555667-40666597	1		13q14.11	yes		alveolar rhabdomyosarcoma			M	Dom	"oncogene, TSG, fusion"	T	"PAX3, PAX7"			"CCDS9371.1,ENSG00000150907.7,FKH1,FKHR,FOXO1A,NM_002015.3,NP_002006,Q12778"
FOXO3	forkhead box O3	2309	6:108560866-108684768	1		6q21	yes		AL			L	Dom	"oncogene, TSG, fusion"	T	KMT2A			"AF6q21,CCDS5068.1,ENSG00000118689.14,FKHRL1,FOXO2,FOXO3A,NM_001455.3,NP_001446,O43524"
FOXO4	forkhead box O4	4303	X:71096197-71103535	1		Xq13.1	yes		"AL, soft tissue sarcoma"			"L, M"	Dom	"oncogene, TSG, fusion"	T	"KMT2A, CIC"			"AFX1,CCDS43969.1,ENSG00000184481.16,MLLT7,NM_005938.3,NP_005929,P98177"
FOXP1	forkhead box P1	27086	3:70954715-71583989	1		3p13	yes		ALL			L	Dom	"oncogene, fusion"	T	PAX5			"12CC4,CCDS74964.1,ENSG00000114861.19,HSPC215,NM_001244810.1,NP_001231739,Q9H334,QRF1,hFKH1B"
FOXR1	forkhead box R1	283150	11:118971707-118981291	2		11q23.3	yes		neuroblastoma			O		"oncogene, fusion"	T				"CCDS31688.1,DLNB13,ENSG00000176302.12,FOXN5,NM_181721.2,NP_859072,Q6PIV2"
FSTL3	follistatin-like 3 (secreted glycoprotein)	10272	19:676365-683399	1		19p13.3	yes		B-CLL			L	Dom	"oncogene, fusion"	T	CCND1			"CCDS12040.1,ENSG00000070404.9,FLRG,FSRP,NM_005860.2,NP_005851,O95633"
FUBP1	far upstream element (FUSE) binding protein 1	8880	1:77948405-77979086	1	Yes	1p31.1	yes		oligodendroglioma			O	Rec	oncogene	"F, N"				"CCDS683.1,ENSG00000162613.16,FBP,FUBP,NM_003902.4,NP_003893,NP_001290362.1,Q96AE4"
FUS	"fusion, derived from t(12;16) malignant liposarcoma"	2521	16:31180110-31194871	1	Yes	16p11.2	yes		"liposarcoma, AML, Ewing sarcoma, angiomatoid fibrous histiocytoma, fibromyxoid sarcoma"			"M, L"	Dom	"TSG, fusion"	T	"DDIT3, ERG, FEV, ATF1, CREB3L2, CREB3L1, NFATC2"			"ALS6,CCDS10707.1,ENSG00000089280.18,FUS1,HNRNPP2,NM_004960.3,NP_004951,NP_001164408.1,P35637,TLS,hnRNP-P2"
GAS7	growth arrest-specific 7	8522	17:9913850-10198551	1	Yes	17p13.1	yes		AML*			L	Dom	fusion	T	KMT2A			"CCDS11152.1,ENSG00000007237.18,KIAA0394,MGC1348,NM_201433.1,NP_958839,O60861"
GATA1	GATA binding protein 1 (globin transcription factor 1)	2623	X:48786554-48794308	1	Yes	Xp11.23	yes		megakaryoblastic leukaemia of Downs syndrome			L	Dom	"oncogene, TSG"	"Mis, F"				"CCDS14305.1,ENSG00000102145.13,ERYF1,GATA-1,GF1,NF-E1,NFE1,NM_002049.3,NP_002040,P15976"
GATA2	GATA binding protein 2	2624	3:128479427-128493185	1	Yes	3q21.3	yes		AML (CML blast transformation)			L	Dom	oncogene	Mis				"CCDS3049.1,ENSG00000179348.11,NFE1B,NM_032638.4,NP_116027,P23769"
GATA3	GATA binding protein 3	2625	10:8054653-8075203	1	Yes	10p14	yes		breast			E	Rec	"oncogene, TSG"	"F, N, S"		yes	"HDR syndrome (hypoparathyroidism, sensorineural deafness, and renal disease)"	"CCDS31143.1,ENSG00000107485.16,HDR,NM_001002295.1,NP_001002295,P23771"
GLI1	GLI family zinc finger 1	2735	12:57460138-57472262	2		12q13.3	yes		"CRC, oesophagus cancer"			E		"oncogene, fusion"	"T, F"		yes	IBD	"CCDS8940.1,ENSG00000111087.9,GLI,NM_005269.2,NP_005260,P08151"
GMPS	guanine monphosphate synthetase	8833	3:155870536-155944026	2		3q25.31	yes		AML			L	Dom	fusion	T	KMT2A			"CCDS46941.1,ENSG00000163655.15,GATD7,NM_003875.2,NP_003866,P49915"
GNA11	"guanine nucleotide binding protein (G protein), alpha 11 (Gq class)"	2767	19:3094410-3124004	1	Yes	19p13.3	yes		"uveal melanoma, primary central nervous system melanocytic neoplasms"			"E, O"	Dom	oncogene	Mis				"CCDS12103.1,ENSG00000088256.8,FBH,FBH2,FHH2,HHC2,NM_002067.4,NP_002058,P29992"
GNAQ	"guanine nucleotide binding protein (G protein), q polypeptide"	2776	9:77716087-78031458	1	Yes	9q21.2	yes		"uveal melanoma, primary central nervous system melanocytic neoplasms"			"E, O"	Dom	oncogene	Mis				"CCDS6658.1,ENSG00000156052.10,G-ALPHA-q,GAQ,NM_002072.4,NP_002063,P50148"
GNAS	"guanine nucleotide binding protein (G protein), alpha stimulating activity polypeptide 1"	2778	20:58852714-58911192	1	Yes	20q13.32	yes		"pituitary adenoma, pancreatic intraductal papillary mucinous neoplasm, fibrous dysplasia"			"E, M"	Dom	oncogene	Mis		yes	"McCune-Albright syndrome; pseudohypoparathyroidism, type IA"	"CCDS46622.1,ENSG00000087460.24,GNAS1,GNASXL,GPSA,NESP,NESP55,NM_080425.3,NP_536350,Q5JWF2,SCG6,SgVI"
GOLGA5	"golgi autoantigen, golgin subfamily a, 5  (PTC5)"	9950	14:92794231-92839963	1		14q32.12	yes		"papillary thyroid, Spitzoid tumour"			E	Dom	fusion	T	RET			"CCDS9905.1,ENSG00000066455.12,GOLIM5,NM_005113.3,NP_005104,NP_005104.3,Q8TBA6,golgin-84,ret-II,rfg5"
GOLPH3	Golgi Phosphoprotein 3	64083	5:32124704-32174350	2		5p13.3	yes		"breast cancer, NSCLC, ovarian cancer"			E			A				"CCDS3896.1,ENSG00000113384.13,GOPP1,GPP34,MIDAS,NM_022130.3,NP_071413,Q9H4A6,Vps74"
GOPC	golgi associated PDZ and coiled-coil motif containing	57120	6:117560269-117602364	1		6q22.1	yes		"glioblastoma, cholangiocarcinoma, borderline ovarian"			"E, O"	Dom	fusion	T	ROS1			"CAL,CCDS5117.1,ENSG00000047932.13,FIG,GOPC1,NM_020399.3,NP_065132,PIST,Q9HD26,dJ94G16.2"
GPC3	glypican 3	2719	X:133535754-133985646	1	Yes	Xq26.2		yes		Wilms tumour	Simpson-Golabi-Behmel syndrome	O	Rec/X	"oncogene, TSG"	"D, Mis, N, F, S"				"CCDS55496.1,DGSX,ENSG00000147257.13,NM_001164617.1,NP_001158089,OCI-5,P51654,SDYS,SGB,SGBS,SGBS1"
GPC5	glypican 5	2262	13:91398607-92867237	2		13q31.3	yes		lung adenocarcinoma			E		TSG	D				"CCDS9468.1,ENSG00000179399.14,NM_004466.5,NP_004457,P78333"
GPHN	gephyrin (GPH)	10243	14:66507407-67181803	1		14q23.3	yes		AL			L	Dom	fusion	T	KMT2A			"CCDS9777.1,ENSG00000171723.15,KIAA1385,NM_020806.4,NP_065857,Q9NQX3"
GRIN2A	"glutamate receptor, ionotropic, N-methyl D-aspartate 2A"	2903	16:9753404-10182754	1	Yes	16p13.2	yes		"melanoma, colorectal carcinoma, gastric carcinoma, lung carcinoma"			E	Rec	TSG	"Mis, N, F, O"		yes	Focal epilepsy and speech disorder with or without mental retardation	"CCDS10539.1,ENSG00000183454.16,GluN2A,NMDAR2A,NM_000833.4,NP_000824,Q12879"
GRM3	glutamate metabotropic receptor 3	2913	7:86643914-86864884	2		7q21.12	yes		"melanoma, oral SCC"			E		oncogene	"Mis, A"				"CCDS5600.1,ENSG00000198822.10,GPRC1C,MGLUR3,NM_000840.2,NP_000831,Q14832,mGlu3"
GSK3B	Glycogen Synthase Kinase 3 Beta	2932	3:119826686-120093666	2		3q13.33	yes		endometrial cancer			E			"F, Mis, N"				"CCDS2996.1,ENSG00000082701.14,NM_002093.3,NP_002084,P49841"
GTF2I	General transcription factor IIi	2969	7:74657685-74760692	2		7q11.23	yes		thymoma			E			Mis			Williams-Beuren syndrome	"BAP-135,BTKAP1,CCDS5573.1,DIWS,ENSG00000263001.5,IB291,NM_032999.3,NP_127492,P78347,SPIN,TFII-I,WBSCR6"
H3F3A	"H3 histone, family 3A"	3020	1:226063977-226072001	1	Yes	1q42.12	yes		glioma			O	Dom	oncogene	Mis				"CCDS1550.1,ENSG00000163041.9,H3.3A,H3F3,P84243"
H3F3B	"H3 histone, family 3B (H3.3B)"	3021	17:75776434-75779779	1	Yes	17q25.1	yes		chondroblastoma			M	Dom	oncogene	Mis				"CCDS11729.1,ENSG00000132475.10,H3.3B,NM_005324.4,NP_005315,P84243"
HERPUD1	"homocysteine-inducible, endoplasmic reticulum stress-inducible, ubiquitin-like domain member 1"	9709	16:56932048-56944863	1		16q13	yes		prostate			E	Dom	fusion	T	ERG			"CCDS10771.1,ENSG00000051108.14,HERP,KIAA0025,Mif1,NM_014685.3,NP_055500,NP_001259032.1,Q15011,SUP"
HEY1	hairy/enhancer-of-split related with YRPW motif 1	23462	8:79764013-79767857	1	Yes	8q21.13	yes		mesenchymal chondrosarcoma			M	Dom	"oncogene, fusion"	T	NCOA2			"CCDS43749.1,CHF-2,CHF2,ENSG00000164683.16,HERP2,HESR-1,HESR1,HRT-1,NM_001040708.1,NP_001035798,Q9Y5J3,bHLHb31"
HGF	Hepatocyte growth factor	3082	7:81699008-81770198	1		7q21.11	yes	yes	"breast cancer, lung cancer, multiple myeloma"	bladder cancer		"E, M"		"oncogene, fusion"	"A, F, Mis, N, T"	CACNA2D1			"CCDS5597.1,DFNB39,ENSG00000019991.16,F-TCF,HGFB,HPTA,NM_000601.5,NP_000592,P14210,SF"
HIF1A	hypoxia inducible factor 1 alpha subunit	3091	14:61697622-61748259	1	Yes	14q23.2	yes		"endometrioid carcinoma, glioblastoma, colorectal, renal, lung, pancreatic"			"E, O"	Dom	oncogene	"Mis, F, N"				"CCDS58324.1,ENSG00000100644.16,HIF-1alpha,HIF1,MOP1,NM_001243084.1,NP_001230013,PASD8,Q16665,bHLHe78"
HIP1	huntingtin interacting protein 1	3092	7:75533300-75738947	1	Yes	7q11.23	yes		"CMML, NSCLC"			"L, E"	Dom	"oncogene, fusion"	T	"PDGFRB, ALK"			"CCDS34669.1,ENSG00000127946.16,ILWEQ,NM_005338.6,NP_005329,O00291"
HIST1H3B	"histone cluster 1, H3b"	8358	6:26031650-26032060	1	Yes	6p22.2	yes		glioma			O	Dom	oncogene	Mis				"CCDS4573.1,ENSG00000274267.1,H3/l,H3FL,NM_003537.3,NP_003528,P68431"
HIST1H4I	"histone 1, H4i (H4FM)"	8294	6:27138588-27139881	1		6p22.1	yes		NHL			L	Dom	fusion	T	BCL6			"CCDS4620.1,ENSG00000276180.1,H4/m,H4FM,NM_003495.2,NP_003486,P62805"
HLA-A	"major histocompatibility complex, class I, A"	3105	6:29941260-29945884	1		6p22.1	yes		Spitzoid tumour			E	Dom	fusion	T	ROS1	yes	Carbamazepine-induced hypersensitivity syndrome	"CCDS34373.1,ENSG00000206503.12,P04439,P13746,P16188"
HLF	hepatic leukemia factor	3131	17:55265012-55325065	1		17q22	yes		ALL			L	Dom	"oncogene, fusion"	T	TCF3			"CCDS11585.1,ENSG00000108924.13,MGC33822,NM_002126.4,NP_002117,Q16534"
HMGA1	high mobility group AT-hook 1	3159	6:34236873-34246230	1		6p21.31	yes		"microfollicular thyroid adenoma, various benign mesenchymal tumours"			"E, M"	Dom	"oncogene, fusion"	T	?			"CCDS4789.1,ENSG00000137309.19,HMGIY,NM_145901.2,NP_665908,NP_001306010,NP_001306007,P17096"
HMGA2	high mobility group AT-hook 2 (HMGIC)	8091	12:65824460-65915447	1		12q14.3	yes		"lipoma, leiomyoma, pleomorphic salivary gland adenoma"			M	Dom	"oncogene, fusion"	T	"LHFP, RAD51B, LPP, COX6C, ACKR3, NFIB, ALDH2, CCNB1IP1, EBF1, WIF1, FHIT"			"BABL,CCDS73491.1,ENSG00000149948.13,HMGIC,LIPO,NM_001300919.1,NP_001287848"
HMGN2P46	high mobility group nucleosomal binding domain 2 pseudogene 46		15:45511136-45556730	2		15q21.1	yes		prostate			E	Dom	fusion	T	ETV1			
HNF1A	HNF1 homeobox A	6927	12:120978749-121001269	1	Yes	12q24.31	yes	yes	"hepatic adenoma, hepatocellular"	"hepatic adenoma, hepatocellular carcinoma"	familial hepatic adenoma	E	Rec	TSG	"Mis, F"		yes	"Maturity-onset diabetes of the young, TYPE III"	"CCDS76611.1,ENSG00000135100.17,HNF1,LFB1,MODY3,NM_001306179.1,NP_001293108,NP_001293108.1,TCF1"
HNRNPA2B1	heterogeneous nuclear ribonucleoprotein A2/B1	3181	7:26189927-26200746	1	Yes	7p15.2	yes		prostate			E	Dom	"oncogene, fusion"	T	ETV1			"CCDS43557.1,ENSG00000122566.20,HNRPA2B1,NM_031243.2,NP_112533,P22626"
HOOK3	hook homolog 3	84376	8:42896932-43030539	1		8p11.21	yes		papillary thyroid			E	Dom	fusion	T	RET			"CCDS6139.1,ENSG00000168172.8,HK3,NM_032410.3,NP_115786,Q86VS8"
HOXA11	homeo box A11	3207	7:27181515-27185216	1	Yes	7p15.2	yes		CML			L	Dom	"oncogene, TSG, fusion"	T	NUP98			"CCDS5411.1,ENSG00000005073.5,HOX1,HOX1I,NM_005523.5,NP_005514,P31270"
HOXA13	homeo box A13	3209	7:27194364-27200106	1		7p15.2	yes		AML			L	Dom	"oncogene, fusion"	T	NUP98			"CCDS5412.1,ENSG00000106031.7,HOX1,HOX1J,NM_000522.4,NP_000513,P31271"
HOXA9	homeo box A9	3205	7:27162435-27165530	1		7p15.2	yes		AML*			L	Dom	"oncogene, TSG, fusion"	T	"NUP98, MSI2"			"CCDS5409.1,ENSG00000078399.17,HOX1,HOX1G,NM_152739.3,NP_689952,P31269"
HOXC11	homeo box C11	3227	12:53973126-53977643	1		12q13.13	yes		AML			L	Dom	"oncogene, fusion"	T	NUP98			"CCDS8867.1,ENSG00000123388.4,HOX3H,NM_014212.3,NP_055027,O43248"
HOXC13	homeo box C13	3229	12:53938765-53946544	1		12q13.13	yes		AML			L	Dom	"oncogene, fusion"	T	NUP98			"CCDS8865.1,ENSG00000123364.4,HOX3,HOX3G,NM_017410.2,NP_059106,P31276"
HOXD11	homeo box D11	3237	2:176107286-176109588	1		2q31.1	yes		AML			L	Dom	"oncogene, fusion"	T	NUP98			"CCDS2265.1,ENSG00000128713.13,HOX4,HOX4F,NM_021192.2,NP_067015,P31277"
HOXD13	homeo box D13	3239	2:176092891-176095938	1		2q31.1	yes		AML*			L	Dom	"oncogene, fusion"	T	NUP98			"CCDS2264.2,ENSG00000128714.5,HOX4I,NM_000523.3,NP_000514,P35453,SPD"
